{
  "schemaVersion": "1.0.0",
  "run": {
    "utcTimestamp": "2026-02-13T05:15:57.2032048Z",
    "repository": "xfaith4/genesys-contract-client",
    "branch": "copilot/run-baseline-harding-pass",
    "commitSha": "1ddddfe4b12ac035f8debb2b71ed7ea963299959",
    "actor": "copilot-swe-agent[bot]",
    "environment": {
      "os": "Ubuntu 24.04.3 LTS",
      "pwsh": "7.4.13",
      "node": "v24.13.0",
      "python": "Python 3.12.3"
    }
  },
  "summary": {
    "status": "pass",
    "totalChecks": 2,
    "passedChecks": 2,
    "failedChecks": 0,
    "durationSeconds": 11.639
  },
  "commands": [
    {
      "command": "pwsh -File tests/Genesys.ContractClient.Tests.ps1",
      "cwd": "/home/runner/work/genesys-contract-client/genesys-contract-client",
      "exitCode": 0,
      "durationMs": 6624,
      "stdoutExcerpt": "\u001b[95m\n\u001b[95mStarting discovery in 1 files.\u001b[0m\n\u001b[95mDiscovery found 4 tests in 1.9s.\u001b[0m\n\u001b[95mRunning tests.\u001b[0m\n\u001b[32m[+] /home/runner/work/genesys-contract-client/genesys-contract-client/tests/Genesys.ContractClient.Tests.ps1\u001b[0m\u001b[90m 2.43s (260ms|292ms)\u001b[0m\n\u001b[97mTests completed in 2.44s\u001b[0m\n\u001b[32mTests Passed: 4, \u001b[0m\u001b[90mFailed: 0, \u001b[0m\u001b[90mSkipped: 0, \u001b[0m\u001b[90mInconclusive: 0, \u001b[0m\u001b[37m\u001b[0m\u001b[90mNotRun: 0\u001b[0m\n",
      "stderrExcerpt": ""
    },
    {
      "command": "pwsh -NoLogo -NoProfile -Command \"Set-Location src/mcp-server; npm test\"",
      "cwd": "/home/runner/work/genesys-contract-client/genesys-contract-client",
      "exitCode": 0,
      "durationMs": 4973,
      "stdoutExcerpt": "\n> genesys-contract-client-mcp@0.1.0 test\n> npm run build && node scripts/run-node-tests.mjs\n\n\n> genesys-contract-client-mcp@0.1.0 build\n> tsc -p tsconfig.json\n\n✔ summarizeRequest logs allowlisted fields and omits everything else (2.836925ms)\n✔ redactForLog masks nested secret fields (0.340855ms)\n✔ schema validator enforces oneOf semantics (21.732469ms)\n✔ schema validator enforces anyOf semantics (4.625135ms)\n✔ schema validator preserves allOf merge behavior (5.883773ms)\n✔ schema validator rejects unknown properties in strict mode (2.198004ms)\n{\"ts\":\"2026-02-13T05:16:07.153Z\",\"level\":\"info\",\"event\":\"http.request\",\"requestId\":\"6ddbe641-b4bc-44e9-9846-6d60d637a1e1\",\"method\":\"POST\",\"path\":\"/mcp\",\"status\":200,\"durationMs\":13}\n{\"ts\":\"2026-02-13T05:16:07.167Z\",\"level\":\"info\",\"event\":\"http.request\",\"requestId\":\"8ce7fcfe-543c-466c-9ffb-a36b2ccc08fe\",\"method\":\"POST\",\"path\":\"/mcp\",\"status\":200,\"durationMs\":5}\n{\"ts\":\"2026-02-13T05:16:07.213Z\",\"level\":\"info\",\"event\":\"http.request\",\"requestId\":\"02834a2b-937e-4892-b9de-f3469bc1d54a\",\"method\":\"POST\",\"path\":\"/mcp\",\"status\":200,\"durationMs\":5}\nException in PromiseRejectCallback:\nfile:///home/runner/work/genesys-contract-client/genesys-contract-client/src/mcp-server/node_modules/@modelcontextprotocol/sdk/dist/esm/server/webStandardStreamableHttp.js:620\n    }\n    ^\n\nRangeError: Maximum call stack size exceeded\n\nException in PromiseRejectCallback:\nfile:///home/runner/work/genesys-contract-client/genesys-contract-client/src/mcp-server/node_module...[truncated]",
      "stderrExcerpt": ""
    }
  ],
  "findings": [],
  "evidence": [
    {
      "type": "log",
      "path": "reports/test-runs/20260213T051557Z-cmd-01.log",
      "description": "Command receipt log"
    },
    {
      "type": "log",
      "path": "reports/test-runs/20260213T051557Z-cmd-02.log",
      "description": "Command receipt log"
    },
    {
      "type": "report",
      "path": "reports/test-runs/20260213T051557Z-report.json",
      "description": "Machine-readable test run report"
    },
    {
      "type": "report",
      "path": "reports/test-runs/20260213T051557Z-report.md",
      "description": "Human-readable test run report"
    }
  ],
  "residualRisks": []
}
